{
  "schema_version": "v2.1.1",
  "run_id": "123e4567-e89b-72d3-a456-426614174000",
  "source_id": "SRC01",
  "created_at": "2026-03-05T12:51:06.071215+00:00",
  "qa_items": [
    {
      "construct_id": "CNSTR001",
      "noise_flag": false,
      "priority_score": 92.0,
      "priority_band": "A",
      "suggested_type": "System",
      "suggested_register": "Operator",
      "suggested_alias_cluster": [
        "CEP",
        "Codex Extraction Protocol"
      ],
      "footprint_recalc_pages": [
        "p.1",
        "p.2",
        "p.3"
      ],
      "downstream_eligible": true,
      "rationale": "High centrality term; likely referenced in multiple passes."
    }
  ]
}
